{
  "schema_version": "1",
  "run_id": "run-20260930-001",
  "launch_id": "launch-0001",
  "entry": "c-cli",
  "argv": ["c-suite", "run", "--case", "f1-stdin"],
  "env_names": ["CAN_LOCALE", "PATH"],
  "env_digest": "sha256:c1c1c1c1c1c1c1c1c1c1c1c1c1c1c1c1c1c1c1c1c1c1c1c1c1c1c1c1c1c1c1c1",
  "log_sink": "fd2"
}
